{
  "run_id": "d7s-langchain-s0",
  "task_id": "07b_tools_session",
  "variant": "default",
  "framework": "langchain",
  "framework_version": "1.3.6",
  "model_alias": "gemini-2.5-flash",
  "started_at": "2026-06-19T20:04:06.687683Z",
  "ended_at": "2026-06-19T20:04:23.031119Z",
  "latency_ms": 16343,
  "cold_start_ms": 0,
  "ttft_ms": null,
  "tokens": {
    "input": 0,
    "output": 0,
    "cached": 0
  },
  "tool_calls": 0,
  "ram_peak_mb": 96.22,
  "cpu_user_s": 0.49,
  "cpu_sys_s": 0.122,
  "success": {
    "ok": false,
    "reason": "success kind 'tool_session' not implemented in T1 scaffold"
  },
  "answer": {
    "ok": true
  },
  "error": null,
  "host": {
    "hostname": "Daniels-MacBook-Pro.local",
    "os": "Darwin 25.5.0",
    "cpu_model": "arm",
    "ram_gb": 24.0
  },
  "extras": {
    "turn_boundaries": [
      "2026-06-19T20:04:06.706580Z",
      "2026-06-19T20:04:08.748621Z",
      "2026-06-19T20:04:10.200512Z",
      "2026-06-19T20:04:11.878197Z",
      "2026-06-19T20:04:13.619896Z",
      "2026-06-19T20:04:15.347756Z",
      "2026-06-19T20:04:16.825313Z",
      "2026-06-19T20:04:18.833076Z",
      "2026-06-19T20:04:20.267311Z",
      "2026-06-19T20:04:21.608295Z",
      "2026-06-19T20:04:23.030837Z"
    ],
    "n_turns": 10,
    "answers": [
      "I've created a shipment for order A-1042 with 2-day delivery. The shipment ID is SHP-A-1042-CREATED.",
      "I've sent the Q3 report to finance@acme.com.",
      "I've sent a password reset link to u_88 by email.",
      "I've issued a refund of 25 USD for order A-1042 due to a damaged item.",
      "I've charged customer c_77's card 49.99 USD for the subscription renewal.",
      "I've added 50 units of SKU-991 to stock.",
      "I've created a shipment for order A-1042 with 2-day delivery. The shipment ID is SHP-A-1042-CREATED.",
      "I've sent the Q3 report to finance@acme.com.",
      "I've sent a password reset link to u_88 by email.",
      "I've issued a refund of 25 USD for order A-1042 due to a damaged item."
    ]
  }
}