{
  "run_id": "d7s-colmena-eager-s3",
  "task_id": "07b_tools_session",
  "variant": "default",
  "framework": "colmena",
  "framework_version": "0.4.0",
  "model_alias": "gemini-2.5-flash",
  "started_at": "2026-06-20T21:59:17.563016Z",
  "ended_at": "2026-06-20T22:02:06.752894Z",
  "latency_ms": 169189,
  "cold_start_ms": 0,
  "ttft_ms": null,
  "tokens": {
    "input": 0,
    "output": 0,
    "cached": 0
  },
  "tool_calls": 0,
  "ram_peak_mb": 46.61,
  "cpu_user_s": 0.617,
  "cpu_sys_s": 0.293,
  "success": {
    "ok": false,
    "reason": "success kind 'tool_session' not implemented in T1 scaffold"
  },
  "answer": {
    "ok": true
  },
  "error": null,
  "host": {
    "hostname": "Daniels-MacBook-Pro.local",
    "os": "Darwin 25.5.0",
    "cpu_model": "arm",
    "ram_gb": 24.0
  },
  "extras": {
    "turn_boundaries": [
      "2026-06-20T21:59:17.563400Z",
      "2026-06-20T21:59:33.196965Z",
      "2026-06-20T21:59:51.060753Z",
      "2026-06-20T22:00:07.803987Z",
      "2026-06-20T22:00:25.124278Z",
      "2026-06-20T22:00:43.165458Z",
      "2026-06-20T22:00:59.228560Z",
      "2026-06-20T22:01:15.814573Z",
      "2026-06-20T22:01:32.929161Z",
      "2026-06-20T22:01:50.039553Z",
      "2026-06-20T22:02:06.752764Z"
    ],
    "lazy": false,
    "n_turns": 10,
    "answers": [
      "I can do that. What should the subject and body of the email be?",
      "I've opened a new ticket, TKT-C31-OPENED, for the checkout page crashing issue.",
      "I've charged customer c_77's card for 49.99 for the subscription renewal. The charge ID is CHG-C77-CAPTURED.",
      "I've adjusted the stock for SKU-991, adding 50 units.",
      "I've issued a refund of 25 USD for order A-1042 due to a damaged item.",
      "I've created a 2-day shipment for order A-1042. The shipment ID is SHP-A-1042-CREATED.",
      "I've sent the Q3 report to finance@acme.com.",
      "I've opened a new ticket, TKT-C31-OPENED, for the checkout page crashing issue.",
      "I've charged customer c_77's card for 49.99 for the subscription renewal. The charge ID is CHG-C77-CAPTURED.",
      "I've adjusted the stock for SKU-991, adding 50 units."
    ]
  }
}