{
  "run_id": "d7s-langchain-s2",
  "task_id": "07b_tools_session",
  "variant": "default",
  "framework": "langchain",
  "framework_version": "1.3.6",
  "model_alias": "gemini-2.5-flash",
  "started_at": "2026-06-19T20:04:42.168957Z",
  "ended_at": "2026-06-19T20:04:57.241614Z",
  "latency_ms": 15072,
  "cold_start_ms": 0,
  "ttft_ms": null,
  "tokens": {
    "input": 0,
    "output": 0,
    "cached": 0
  },
  "tool_calls": 0,
  "ram_peak_mb": 96.23,
  "cpu_user_s": 0.463,
  "cpu_sys_s": 0.098,
  "success": {
    "ok": false,
    "reason": "success kind 'tool_session' not implemented in T1 scaffold"
  },
  "answer": {
    "ok": true
  },
  "error": null,
  "host": {
    "hostname": "Daniels-MacBook-Pro.local",
    "os": "Darwin 25.5.0",
    "cpu_model": "arm",
    "ram_gb": 24.0
  },
  "extras": {
    "turn_boundaries": [
      "2026-06-19T20:04:42.188324Z",
      "2026-06-19T20:04:42.994068Z",
      "2026-06-19T20:04:44.964316Z",
      "2026-06-19T20:04:45.681084Z",
      "2026-06-19T20:04:46.548959Z",
      "2026-06-19T20:04:48.126423Z",
      "2026-06-19T20:04:50.024774Z",
      "2026-06-19T20:04:51.726540Z",
      "2026-06-19T20:04:53.731079Z",
      "2026-06-19T20:04:55.694271Z",
      "2026-06-19T20:04:57.241335Z"
    ],
    "n_turns": 10,
    "answers": [
      "",
      "I can only perform one action at a time. Please choose whether you'd like to reset the password or schedule the meeting.",
      "",
      "I can only perform one action at a time. Please choose whether you'd like to charge the card or ship the order.",
      "I've adjusted the stock for SKU-991 by 50 units.",
      "I've issued a refund of 25 USD for order A-1042 due to a damaged item.",
      "I've sent a password reset link to user u_88 via email.",
      "I've scheduled a 30-minute call with Ana for next Tuesday at 3pm.",
      "I've charged customer c_77's card 49.99 for the subscription renewal.",
      "I've created a 2-day shipment for order A-1042."
    ]
  }
}