{
  "run_id": "65b213ad-6277-4994-ae00-77696a4156bb",
  "task_id": "05_context_scrubbing",
  "variant": "default",
  "framework": "langchain",
  "framework_version": "1.3.6",
  "model_alias": "gemini-2.5-flash",
  "started_at": "2026-06-17T02:44:08.126396Z",
  "ended_at": "2026-06-17T02:44:28.849990Z",
  "latency_ms": 20723,
  "cold_start_ms": 0,
  "ttft_ms": null,
  "tokens": {
    "input": 0,
    "output": 0,
    "cached": 0
  },
  "tool_calls": 0,
  "ram_peak_mb": 95.94,
  "success": {
    "ok": false,
    "reason": "success kind 'multi_turn_demo' not implemented in T1 scaffold"
  },
  "answer": [
    "Acme Analytics, Inc. reported total revenue of $12,600k in Q3 2026, a 16.5% quarter-over-quarter growth. Latin America (38%) and Asia Pacific (24%) led regional growth, while North America remained the largest contributor. Monthly bookings showed a consistent upward trend.\n\nKey risks include high supply chain concentration, FX exposure in Latin America, and customer concentration. For Q4 2026, the company plans for continued momentum across regions, with a healthy pipeline coverage ratio.\n\nThe Platform product line contributed 68% of revenue and grew by 18% QoQ, driving overall performance. The company added 25 net new logos, achieved a Net Revenue Retention (NRR) of 118%, and saw the median contract value increase to $31k ARR.\n\nHeadcount increased to 284, and operating expenses rose by 8% to $9,840k, with employee costs and cloud infrastructure being the largest components. The competitive win rate improved to 64%, with pricing and missing predictive analytics features being the main reasons for losses.\n\nFor Q4 2026, the target is $14,200k in total bookings, with marketing generating 1,240 qualified opportunities and improving MQL-to-SQL conversion.",
    "North America had the highest revenue in Q3 2026, with $4,200k.",
    "The chart was generated.",
    "The quarter-over-quarter revenue growth rate was 16.5%.",
    "Yes, management views the trend as positive.",
    "The chart was generated.",
    "The charts illustrate that North America was the highest revenue-generating region in Q3 2026, while overall monthly bookings demonstrated a positive upward trend throughout the quarter.",
    "The top 3 risks listed in the report are:\n1. Supply chain concentration (severity: High)\n2. FX exposure in Latin America (severity: Medium)\n3. Customer concentration (severity: Medium)",
    "The chart was generated.",
    "In Q3 2026, Acme Analytics, Inc. achieved $12,600k in revenue, marking a 16.5% QoQ growth, primarily driven by Latin America and Asia Pacific, with North America as the largest contributor. Monthly bookings showed a positive upward trend. The main risks identified were supply chain concentration (High severity), FX exposure in Latin America (Medium severity), and customer concentration (Medium severity). Charts were generated to visualize revenue by region, monthly bookings, and risk severity."
  ],
  "error": null,
  "host": {
    "hostname": "192.168.40.20",
    "os": "Darwin 25.5.0",
    "cpu_model": "arm",
    "ram_gb": 24.0
  },
  "extras": {
    "turn_boundaries": [
      "2026-06-17T02:44:08.128061Z",
      "2026-06-17T02:44:11.343148Z",
      "2026-06-17T02:44:12.157261Z",
      "2026-06-17T02:44:14.612884Z",
      "2026-06-17T02:44:15.346573Z",
      "2026-06-17T02:44:16.766684Z",
      "2026-06-17T02:44:19.333160Z",
      "2026-06-17T02:44:22.380918Z",
      "2026-06-17T02:44:23.314968Z",
      "2026-06-17T02:44:26.801223Z",
      "2026-06-17T02:44:28.849812Z"
    ],
    "turn_types": [
      "doc",
      "doc",
      "chart",
      "doc",
      "follow_up",
      "chart",
      "follow_up",
      "doc",
      "chart",
      "follow_up"
    ]
  }
}