{
  "run_id": "d7s-llamaindex-s2",
  "task_id": "07b_tools_session",
  "variant": "default",
  "framework": "llamaindex",
  "framework_version": "0.14.22",
  "model_alias": "gemini-2.5-flash",
  "started_at": "2026-06-19T20:07:47.433823Z",
  "ended_at": "2026-06-19T20:08:06.116633Z",
  "latency_ms": 18682,
  "cold_start_ms": 0,
  "ttft_ms": null,
  "tokens": {
    "input": 0,
    "output": 0,
    "cached": 0
  },
  "tool_calls": 0,
  "ram_peak_mb": 173.56,
  "cpu_user_s": 0.997,
  "cpu_sys_s": 0.191,
  "success": {
    "ok": false,
    "reason": "success kind 'tool_session' not implemented in T1 scaffold"
  },
  "answer": {
    "ok": true
  },
  "error": null,
  "host": {
    "hostname": "Daniels-MacBook-Pro.local",
    "os": "Darwin 25.5.0",
    "cpu_model": "arm",
    "ram_gb": 24.0
  },
  "extras": {
    "turn_boundaries": [
      "2026-06-19T20:07:47.484580Z",
      "2026-06-19T20:07:49.186970Z",
      "2026-06-19T20:07:51.755016Z",
      "2026-06-19T20:07:53.674310Z",
      "2026-06-19T20:07:56.034912Z",
      "2026-06-19T20:07:57.774151Z",
      "2026-06-19T20:07:59.394385Z",
      "2026-06-19T20:08:01.161022Z",
      "2026-06-19T20:08:03.316483Z",
      "2026-06-19T20:08:04.610414Z",
      "2026-06-19T20:08:06.115861Z"
    ],
    "n_turns": 10,
    "answers": [
      "I've sent a password reset link to u_88 by email.",
      "OK. I've scheduled a 30-minute call with Ana for next Tuesday at 3pm.",
      "I've charged customer c_77's card 49.99 for the subscription renewal.",
      "I've created a 2-day shipment for order A-1042.",
      "I've adjusted the stock for SKU-991 by 50 units.",
      "I've issued a 25 USD refund for order A-1042 due to a damaged item.",
      "I've sent a password reset link to u_88 by email.",
      "OK. I've scheduled a 30-minute call with Ana for next Tuesday at 3pm.",
      "I've charged customer c_77's card 49.99 for the subscription renewal.",
      "I've created a 2-day shipment for order A-1042."
    ]
  }
}