{
  "run_id": "d7s-crewai-s3",
  "task_id": "07b_tools_session",
  "variant": "default",
  "framework": "crewai",
  "framework_version": "1.14.6",
  "model_alias": "gemini-2.5-flash",
  "started_at": "2026-06-19T20:03:32.098435Z",
  "ended_at": "2026-06-19T20:03:47.362095Z",
  "latency_ms": 15263,
  "cold_start_ms": 0,
  "ttft_ms": null,
  "tokens": {
    "input": 0,
    "output": 0,
    "cached": 0
  },
  "tool_calls": 0,
  "ram_peak_mb": 279.31,
  "cpu_user_s": 1.308,
  "cpu_sys_s": 0.242,
  "success": {
    "ok": false,
    "reason": "success kind 'tool_session' not implemented in T1 scaffold"
  },
  "answer": {
    "ok": true
  },
  "error": null,
  "host": {
    "hostname": "Daniels-MacBook-Pro.local",
    "os": "Darwin 25.5.0",
    "cpu_model": "arm",
    "ram_gb": 24.0
  },
  "extras": {
    "turn_boundaries": [
      "2026-06-19T20:03:32.098541Z",
      "2026-06-19T20:03:33.149290Z",
      "2026-06-19T20:03:34.740081Z",
      "2026-06-19T20:03:36.438820Z",
      "2026-06-19T20:03:38.317141Z",
      "2026-06-19T20:03:40.233542Z",
      "2026-06-19T20:03:41.992574Z",
      "2026-06-19T20:03:42.726253Z",
      "2026-06-19T20:03:44.430260Z",
      "2026-06-19T20:03:45.984395Z",
      "2026-06-19T20:03:47.362023Z"
    ],
    "n_turns": 10,
    "answers": [
      "I can do that. What should the subject and body of the email be?",
      "OK. I've opened a ticket `TKT-C31-OPENED` for customer `c_31` regarding the checkout page crashing.",
      "I've charged customer `c_77` $49.99 for the subscription renewal. The charge ID is `CHG-C77-CAPTURED`.",
      "I've adjusted the stock for SKU-991 by 50 units.",
      "I've issued a refund of 25 USD for order A-1042 due to a damaged item.",
      "I've created a 2-day shipment for order A-1042. The shipment ID is `SHP-A-1042-CREATED`.",
      "I can do that. What should the subject and body of the email be?",
      "OK. I've opened a ticket `TKT-C31-OPENED` for customer `c_31` regarding the checkout page crashing.",
      "I've charged customer `c_77` $49.99 for the subscription renewal. The charge ID is `CHG-C77-CAPTURED`.",
      "I've adjusted the stock for SKU-991 by 50 units."
    ]
  }
}