{
  "run_id": "d7s-langgraph-s1",
  "task_id": "07b_tools_session",
  "variant": "default",
  "framework": "langgraph",
  "framework_version": "1.2.4",
  "model_alias": "gemini-2.5-flash",
  "started_at": "2026-06-19T20:05:52.554524Z",
  "ended_at": "2026-06-19T20:06:10.053939Z",
  "latency_ms": 17499,
  "cold_start_ms": 0,
  "ttft_ms": null,
  "tokens": {
    "input": 0,
    "output": 0,
    "cached": 0
  },
  "tool_calls": 0,
  "ram_peak_mb": 105.47,
  "cpu_user_s": 0.626,
  "cpu_sys_s": 0.134,
  "success": {
    "ok": false,
    "reason": "success kind 'tool_session' not implemented in T1 scaffold"
  },
  "answer": {
    "ok": true
  },
  "error": null,
  "host": {
    "hostname": "Daniels-MacBook-Pro.local",
    "os": "Darwin 25.5.0",
    "cpu_model": "arm",
    "ram_gb": 24.0
  },
  "extras": {
    "turn_boundaries": [
      "2026-06-19T20:05:52.595779Z",
      "2026-06-19T20:05:54.316153Z",
      "2026-06-19T20:05:56.605303Z",
      "2026-06-19T20:05:58.273674Z",
      "2026-06-19T20:06:00.004366Z",
      "2026-06-19T20:06:01.389822Z",
      "2026-06-19T20:06:04.015645Z",
      "2026-06-19T20:06:05.842126Z",
      "2026-06-19T20:06:07.273865Z",
      "2026-06-19T20:06:08.732177Z",
      "2026-06-19T20:06:10.053677Z"
    ],
    "n_turns": 10,
    "answers": [
      "Order A-1042 has been shipped with 2-day delivery.",
      "25 USD has been refunded to the customer for order A-1042.",
      "The customer c_77 has been charged 49.99 USD for the subscription renewal.",
      "A new ticket has been created for customer c_31 regarding the checkout page crashing.",
      "50 units of SKU-991 have been added to stock.",
      "A 30-minute meeting has been scheduled with Ana for next Tuesday at 3pm.",
      "Order A-1042 has been shipped with 2-day delivery.",
      "25 USD has been refunded to the customer for order A-1042.",
      "The customer c_77 has been charged 49.99 USD for the subscription renewal.",
      "A new ticket has been created for customer c_31 regarding the checkout page crashing."
    ]
  }
}