{
  "run_id": "f871eb29-82f0-443a-b5d6-8354076099e7",
  "task_id": "05_context_scrubbing",
  "variant": "default",
  "framework": "langgraph",
  "framework_version": "1.2.4",
  "model_alias": "gemini-2.5-flash",
  "started_at": "2026-06-17T02:44:29.549506Z",
  "ended_at": "2026-06-17T02:44:53.090111Z",
  "latency_ms": 23540,
  "cold_start_ms": 0,
  "ttft_ms": null,
  "tokens": {
    "input": 0,
    "output": 0,
    "cached": 0
  },
  "tool_calls": 0,
  "ram_peak_mb": 106.75,
  "success": {
    "ok": false,
    "reason": "success kind 'multi_turn_demo' not implemented in T1 scaffold"
  },
  "answer": [
    "Acme Analytics, Inc. reported total revenue of $12,600k for Q3 2026, a 16.5% quarter-over-quarter growth from $10,820k in Q2 2026. Growth was primarily driven by Latin America (38% QoQ growth) and Asia Pacific (24% QoQ growth), while North America remained the largest contributor at $4,200k. Monthly bookings showed an unbroken upward trend, increasing from $3,990k in July to $4,150k in September.\n\nThe principal risks identified are high supply chain concentration, medium FX exposure in Latin America, medium customer concentration, and low talent attrition in engineering.\n\nThe Platform product line was the primary revenue driver, contributing 68% of total revenue ($8,568k) with 18% QoQ growth. The company ended Q3 with 412 paying accounts, a net increase of 25, and a Net Revenue Retention (NRR) of 118%. The median contract value increased to $31k ARR.\n\nTotal headcount grew to 284, and operating expenses increased by 8% to $9,840k. The competitive win rate improved to 64%, with pricing and missing predictive analytics features being the most common reasons for losses. For Q4 2026, the company targets $14,200k in total bookings, a 12.7% sequential increase.",
    "North America had the highest revenue in Q3 2026, with $4,200k.",
    "",
    "A chart of revenue by region has been generated. The quarter-over-quarter revenue growth rate was 16.5%.",
    "Yes, management views the overall trend as positive.",
    "A chart of the monthly bookings trend has been generated.",
    "The two charts together show the regional distribution of revenue in Q3 2026 and a positive, upward trend in monthly bookings throughout that quarter.",
    "The top 3 risks listed in the report are: supply chain concentration (high severity), FX exposure in Latin America (medium severity), and customer concentration (medium severity).",
    "A chart of risk severity has been generated.",
    "Acme Analytics, Inc. experienced a positive Q3 2026 with total revenue of $12,600k, representing a 16.5% QoQ growth, led by Latin America and Asia Pacific, while North America remained the largest revenue contributor. Monthly bookings showed a consistent upward trend, and charts were generated to visualize regional revenue and monthly bookings, as well as the severity of the principal risks: supply chain concentration (high), FX exposure in Latin America (medium), and customer concentration (medium)."
  ],
  "error": null,
  "host": {
    "hostname": "192.168.40.20",
    "os": "Darwin 25.5.0",
    "cpu_model": "arm",
    "ram_gb": 24.0
  },
  "extras": {
    "turn_boundaries": [
      "2026-06-17T02:44:29.552926Z",
      "2026-06-17T02:44:33.002110Z",
      "2026-06-17T02:44:33.597248Z",
      "2026-06-17T02:44:34.683489Z",
      "2026-06-17T02:44:37.680141Z",
      "2026-06-17T02:44:39.092704Z",
      "2026-06-17T02:44:44.032780Z",
      "2026-06-17T02:44:45.954454Z",
      "2026-06-17T02:44:47.597855Z",
      "2026-06-17T02:44:50.454047Z",
      "2026-06-17T02:44:53.089906Z"
    ],
    "turn_types": [
      "doc",
      "doc",
      "chart",
      "doc",
      "follow_up",
      "chart",
      "follow_up",
      "doc",
      "chart",
      "follow_up"
    ]
  }
}