{
  "run_id": "d7s-colmena-lazy-s2",
  "task_id": "07b_tools_session",
  "variant": "default",
  "framework": "colmena",
  "framework_version": "0.4.0",
  "model_alias": "gemini-2.5-flash",
  "started_at": "2026-06-20T21:41:56.791499Z",
  "ended_at": "2026-06-20T21:44:47.332722Z",
  "latency_ms": 170541,
  "cold_start_ms": 0,
  "ttft_ms": null,
  "tokens": {
    "input": 0,
    "output": 0,
    "cached": 0
  },
  "tool_calls": 0,
  "ram_peak_mb": 50.81,
  "cpu_user_s": 0.689,
  "cpu_sys_s": 0.279,
  "success": {
    "ok": false,
    "reason": "success kind 'tool_session' not implemented in T1 scaffold"
  },
  "answer": {
    "ok": true
  },
  "error": null,
  "host": {
    "hostname": "Daniels-MacBook-Pro.local",
    "os": "Darwin 25.5.0",
    "cpu_model": "arm",
    "ram_gb": 24.0
  },
  "extras": {
    "turn_boundaries": [
      "2026-06-20T21:41:56.791777Z",
      "2026-06-20T21:42:14.606868Z",
      "2026-06-20T21:42:32.348759Z",
      "2026-06-20T21:42:50.237697Z",
      "2026-06-20T21:43:07.434103Z",
      "2026-06-20T21:43:24.798729Z",
      "2026-06-20T21:43:42.229492Z",
      "2026-06-20T21:43:58.934978Z",
      "2026-06-20T21:44:14.997734Z",
      "2026-06-20T21:44:31.948785Z",
      "2026-06-20T21:44:47.332569Z"
    ],
    "lazy": true,
    "n_turns": 10,
    "answers": [
      "A password reset link has been sent to u_88 by email.",
      "OK. I've scheduled a 30 minute meeting with Ana for next Tuesday at 3pm.",
      "I have charged customer c_77's card 49.99 for the subscription renewal.",
      "Order A-1042 has been shipped with 2-day delivery.",
      "I've added 50 units of SKU-991 to stock.",
      "I have issued a 25 USD refund for order A-1042 due to a damaged item.",
      "A password reset link has been sent to u_88 by email.",
      "OK. I've scheduled a 30 minute meeting with Ana for next Tuesday at 3pm.",
      "I have charged customer c_77's card 49.99 for the subscription renewal.",
      "Order A-1042 has been shipped with 2-day delivery."
    ]
  }
}