{
  "run_id": "d7s-colmena-lazy-s1",
  "task_id": "07b_tools_session",
  "variant": "default",
  "framework": "colmena",
  "framework_version": "0.4.0",
  "model_alias": "gemini-2.5-flash",
  "started_at": "2026-06-20T21:39:03.482308Z",
  "ended_at": "2026-06-20T21:41:56.678345Z",
  "latency_ms": 173196,
  "cold_start_ms": 0,
  "ttft_ms": null,
  "tokens": {
    "input": 0,
    "output": 0,
    "cached": 0
  },
  "tool_calls": 0,
  "ram_peak_mb": 50.98,
  "cpu_user_s": 0.675,
  "cpu_sys_s": 0.263,
  "success": {
    "ok": false,
    "reason": "success kind 'tool_session' not implemented in T1 scaffold"
  },
  "answer": {
    "ok": true
  },
  "error": null,
  "host": {
    "hostname": "Daniels-MacBook-Pro.local",
    "os": "Darwin 25.5.0",
    "cpu_model": "arm",
    "ram_gb": 24.0
  },
  "extras": {
    "turn_boundaries": [
      "2026-06-20T21:39:03.482579Z",
      "2026-06-20T21:39:21.015573Z",
      "2026-06-20T21:39:38.796807Z",
      "2026-06-20T21:39:57.074896Z",
      "2026-06-20T21:40:15.669645Z",
      "2026-06-20T21:40:34.882844Z",
      "2026-06-20T21:40:52.331808Z",
      "2026-06-20T21:41:08.541609Z",
      "2026-06-20T21:41:24.783954Z",
      "2026-06-20T21:41:40.653204Z",
      "2026-06-20T21:41:56.678209Z"
    ],
    "lazy": true,
    "n_turns": 10,
    "answers": [
      "The shipment for order A-1042 has been created with 2-day delivery. The shipment ID is SHP-A-1042-CREATED.",
      "A refund of 25 USD has been issued for order A-1042 due to a damaged item. The refund ID is REF-A-1042.",
      "The customer c_77 has been charged 49.99 USD for the subscription renewal. The charge ID is CHG-C77-CAPTURED.",
      "A new ticket has been opened for customer c_31 regarding the checkout page crashing. The ticket ID is TKT-C31-OPENED.",
      "50 units of SKU-991 have been added to stock.",
      "A 30-minute meeting has been scheduled with Ana for next Tuesday at 3pm.",
      "The shipment for order A-1042 has been created with 2-day delivery. The shipment ID is SHP-A-1042-CREATED.",
      "A refund of 25 USD has been issued for order A-1042 due to a damaged item. The refund ID is REF-A-1042.",
      "The customer c_77 has been charged 49.99 USD for the subscription renewal. The charge ID is CHG-C77-CAPTURED.",
      "A new ticket has been opened for customer c_31 regarding the checkout page crashing. The ticket ID is TKT-C31-OPENED."
    ]
  }
}